id,reviewId,creationDate,criticName,isTopCritic,originalScore,reviewState,publicatioName,reviewText,scoreSentiment,reviewUrl
1194515-ice_age_dawn_of_the_dinosaurs,1837267,2009-08-11,Daniel M. Kimmel,False,2.5/5,rotten,North Shore Movies,Those who complain about the feeble jokes and contrived situations should be forced to watch the first two films and defend them.,NEGATIVE,http://northshoremovies.wordpress.com/2009/07/01/review-ice-age-dawn-of-the-dinosaurs/
1194515-ice_age_dawn_of_the_dinosaurs,1835676,2009-08-03,Jolene Mendez,False,2/5,rotten,Entertainment Spectrum,It is not the year for pre-historic comebacks.,NEGATIVE,http://www.joreviews.com/movies/ice-age-dawn-of-the-dinosaurs-2
1194515-ice_age_dawn_of_the_dinosaurs,1834780,2009-07-30,Anders Wotzke,False,2.5/5,rotten,Moviedex,"There's not much for audiences over the age of 10 to warm to during this third, and hopefully final, Ice Age.",NEGATIVE,
1194515-ice_age_dawn_of_the_dinosaurs,1832399,2009-07-15,Linda Cook,False,3/4,fresh,"Quad City Times (Davenport, IA)","A baby's on the way, a new acquaintance adds to the fun/confusion, and some old friends are back.",POSITIVE,
1194515-ice_age_dawn_of_the_dinosaurs,1832396,2009-07-15,Michael A. Smith,False,3/4,fresh,Nolan's Pop Culture Review,"...the dinosaurs, especially mama T-Rex rival anything you'd find in ""Jurassic Park.""",POSITIVE,http://crazedfanboy.com/npcr09/moviereviewpcr486.php
1194515-ice_age_dawn_of_the_dinosaurs,1831850,2009-07-11,Cole Smithey,False,C,rotten,ColeSmithey.com,...never properly invites the audience into its messy world of familial trust.,NEGATIVE,http://www.colesmithey.com/capsules/2009/07/ice-age-dawn-of-the-dinosaurs.html
1194515-ice_age_dawn_of_the_dinosaurs,1831707,2009-07-10,John Wirt,False,2/4,rotten,"Advocate (Baton Rouge, LA)",The Ice Age series' creativity is clearly melting.,NEGATIVE,http://www.2theadvocate.com/entertainment/movies/reviews/50479077.html
1194515-ice_age_dawn_of_the_dinosaurs,1831681,2009-07-10,Sean P. Means,False,2/4,rotten,Salt Lake Tribune,"The most reliable laugh-getter in the past Ice Age films, the acorn-seeking Scrat, is saddled with a dull subplot in which he meets a lady Scratte.",NEGATIVE,
1194515-ice_age_dawn_of_the_dinosaurs,1831651,2009-07-10,Renie Scolaro Mora,False,,rotten,PopMatters,"Ice Age: Dawn of the Dinosaurs alters the pattern established by the previous two films, focusing not on the herd but on action-packed, 3-D adventure.",NEGATIVE,http://www.popmatters.com/pm/review/107530-ice-age-dawn-of-the-dinosaurs/
1194515-ice_age_dawn_of_the_dinosaurs,1831036,2009-07-07,Jackie K. Cooper,False,7/10,fresh,jackiekcooper.com,Same cast of characters in another fun and heartwarming story - love those possums!,POSITIVE,http://www.jackiekcooper.com
1194515-ice_age_dawn_of_the_dinosaurs,1830941,2009-07-06,Tim Brayton,False,6/10,rotten,Antagony & Ecstasy,I can't figure out how a character as great [as Scrat] keeps ending up in movies like this.,NEGATIVE,http://antagonie.blogspot.com/2009/07/bland-before-time.html
1194515-ice_age_dawn_of_the_dinosaurs,1830905,2009-07-06,Ben Mankiewicz,True,,rotten,At the Movies,"Certainly not terrible, but ultimately forgettable and that means you should skip it.",NEGATIVE,
1194515-ice_age_dawn_of_the_dinosaurs,1830904,2009-07-06,Ben Lyons,True,,rotten,At the Movies,The whole movie is more of the same and I'm afraid the franchis is running out of steam.,NEGATIVE,http://bventertainment.go.com/tv/buenavista/atm/index.html
1194515-ice_age_dawn_of_the_dinosaurs,1830872,2009-07-06,Ryan Stewart,True,2/4,rotten,Slant Magazine,"This third entry in the animated kiddie series appears to be more, um, fair and balanced.",NEGATIVE,http://www.slantmagazine.com/film/review/ice-age-dawn-of-the-dinosaurs
1194515-ice_age_dawn_of_the_dinosaurs,1830865,2009-07-06,Jeffrey Lyles,False,2/5,rotten,Gazette (MD),"if you want some jokes that aren't prehistoric, you're better off letting this Ice Age defrost.",NEGATIVE,
1194515-ice_age_dawn_of_the_dinosaurs,1830815,2009-07-06,Steve Biodrowski,False,,fresh,Cinefantastique,"None of the Ice Age movies have been particularly brilliant... Fortunately, Dawn of the Dinosaurs has one big advantage over its predecessors: it has dinosaurs.",POSITIVE,http://cinefantastiqueonline.com/2009/07/06/ice-age-dawn-of-the-dinosaurs-animated-film-review/
1194515-ice_age_dawn_of_the_dinosaurs,1830793,2009-07-05,James Kendrick,False,2.5/4,fresh,Q Network Film Desk,"The jokes don't always hit like they should, but there is a pleasant familiarity that mixes well with the sense of adventure to underscore the film's warm-n-fuzzy proclamations about the nature of family and togetherness.",POSITIVE,http://www.qnetwork.com/index.php?page=review&id=2292
1194515-ice_age_dawn_of_the_dinosaurs,1830775,2009-07-04,Kevin A. Ranson,False,2.5/4.0,fresh,MovieCrypt.com,"Who knew... a delusional, swashbuckling, one-eyed weasel... (and) a lost world of dinosaurs would not only make another Ice Age more interesting but actually enjoyable?",POSITIVE,http://moviecrypt.com/?p=3612
1194515-ice_age_dawn_of_the_dinosaurs,1830733,2009-07-04,Susan Granger,False,5/10,rotten,SSG Syndicate,Frigidly sluggish yet familiarly diverting,NEGATIVE,http://susangranger.com/?p=4435
1194515-ice_age_dawn_of_the_dinosaurs,1830728,2009-07-04,Philip Martin,False,80/100,rotten,Arkansas Democrat-Gazette,"...you'll likely be underwhelmed by this kinetic film, which feels like the product of screenwriting software that has yet to become self-aware and develop a sense of shame.",NEGATIVE,
1194515-ice_age_dawn_of_the_dinosaurs,1830717,2009-07-04,Victor Olliver,False,4/5,fresh,Teletext,"Ice Age 3 is wittier than Kung-Fu Panda, certainly as slick as Toy Story. The Ice Age franchise shows no signs of thawing out. Come on 4!",POSITIVE,http://www.teletext.co.uk/bigscreen/film-reviews/5dc1533ad4e556a37c05560cbfc03920/Ice Age 3 (U) 94 mins.aspx
1194515-ice_age_dawn_of_the_dinosaurs,1830709,2009-07-03,Mark Pfeiffer,False,C,rotten,Reel Times: Reflections on Cinema,Ice Age: Dawn of the Dinosaurs needs injections of cartoon merriment and orneriness to cure the blandness afflicting the plot and characters.,NEGATIVE,http://reeltimes.blogspot.com/2009/07/ice-age-dawn-of-dinosaurs.html
1194515-ice_age_dawn_of_the_dinosaurs,1830606,2009-07-03,Jim Lane,False,2/5,rotten,Sacramento News & Review,...again stale sitcom stuff with lame pop culture references...,NEGATIVE,
1194515-ice_age_dawn_of_the_dinosaurs,1830603,2009-07-03,Peter Canavese,False,2.5/4,fresh,Palo Alto Weekly,"Has enough crisp sight gags, character moments, frantic mayhem and musical interludes...to box the family crowd into a state of punch-drunk love.",POSITIVE,
1194515-ice_age_dawn_of_the_dinosaurs,1830598,2009-07-03,JimmyO,False,4/10,rotten,JoBlo's Movie Network,"UP or CORALINE didn't necessarily need the 3D to make it work, it most certainly helps ICE AGE 3.",NEGATIVE,http://www.joblo.com/review-ice-age-dawn-of-the-dinosaurs
1194515-ice_age_dawn_of_the_dinosaurs,1830524,2009-07-03,Steven D. Greydanus,True,C-,rotten,Decent Films,Marks Blue Sky Studios' descent into the kind of crude and suggestive humor they once left to DreamWorks.,NEGATIVE,http://www.decentfilms.com/sections/reviews/2867
1194515-ice_age_dawn_of_the_dinosaurs,1830518,2009-07-03,Derek Adams,True,3/5,fresh,Time Out,"As with the two earlier films, it's all a mite disorderly in tempo but often highly amusing and great fun in the main.",POSITIVE,http://www.timeout.com/film/reviews/87288/ice-age-3-dawn-of-the-dinosaurs.html
1194515-ice_age_dawn_of_the_dinosaurs,1830511,2009-07-03,Jake Wilson,True,2.5/5,rotten,The Age (Australia),"Children will probably enjoy Ice Age 3, but adults may find the script a little over-sophisticated, not to say conflicted in its attitudes towards women.",NEGATIVE,http://www.theage.com.au/news/entertainment/film/film-reviews/ice-age-3/2009/07/01/1246127578605.html
1194515-ice_age_dawn_of_the_dinosaurs,1830493,2009-07-03,Kevin Maher,True,2/5,rotten,Times (UK),"Whereas the previous chapters were sweetly anarchic, full of wisecracks and narrative digressions but also curious about eco-issues such as global warming and the extinction of species, this effort is dramatically inert and uninspired.",NEGATIVE,http://entertainment.timesonline.co.uk/tol/arts_and_entertainment/film/film_reviews/article6630783.ece
1194515-ice_age_dawn_of_the_dinosaurs,1830487,2009-07-03,Peter Bradshaw,True,3/5,fresh,Guardian,Ice Age series comes fully endorsed as a safe ride for all ages.,POSITIVE,http://www.guardian.co.uk/film/2009/jul/03/ice-age-dawn-of-dinosaurs-review
1194515-ice_age_dawn_of_the_dinosaurs,1830484,2009-07-03,Tim Robey,True,3/5,fresh,Daily Telegraph (UK),"Sure, this threequel is more plasticine than Pleistocene, but as a zippy summer diversion it'll do more than nicely - in fact, it's comfortably the best of the series.",POSITIVE,http://www.telegraph.co.uk/culture/film/filmreviews/5723743/Ice-Age-Dawn-of-the-Dinosaurs-review.html
1194515-ice_age_dawn_of_the_dinosaurs,1830481,2009-07-03,Simon Reynolds,False,3/5,fresh,Digital Spy,"With derring-do and a bold spirit, Ice Age 3 rockets along nicely, even if character concessions are made.",POSITIVE,http://www.digitalspy.co.uk/movies/review/a161595/ice-age-3.html
1194515-ice_age_dawn_of_the_dinosaurs,1830473,2009-07-03,Tim Evans,False,3/5,fresh,Sky Cinema,"The Ice Age animators, who have always successfully managed to reinvent the series with each fresh instalment - expand their considerable range with this third offering.",POSITIVE,http://movies.sky.com/review/ice-age-3-dawn-of-the-dinosaurs
1194515-ice_age_dawn_of_the_dinosaurs,1830470,2009-07-03,Kate Stables,False,3/5,fresh,Total Film,"3D heats up a cooling franchise nicely, alternating the familiar friends-forever 'aw' factor and chucklesome comedy chases with some ace in-your-face visuals.",POSITIVE,http://www.totalfilm.com/reviews/cinema/ice-age-dawn-of-the-dinosaurs
1194515-ice_age_dawn_of_the_dinosaurs,1830465,2009-07-03,Simon Thompson,False,8/10,fresh,Heart 106.2,This is the coolest film of the summer as far as family fun goes.,POSITIVE,http://www.heartlondon.co.uk/Article.asp?id=1390632
1194515-ice_age_dawn_of_the_dinosaurs,1830462,2009-07-03,Tom Cox,False,4/5,fresh,Daily Mail (UK),"It's not unusual for a film like this to be full of post-modern, sarcastic dialogue, but Ice Age 3 has a sharper sabretooth than 99 per cent of its contemporaries.",POSITIVE,http://www.dailymail.co.uk/tvshowbiz/reviews/article-1197160/Ice-Age-3-More-woolly-mammoth-fun-critters-Scrat-Pack.html
1194515-ice_age_dawn_of_the_dinosaurs,1830417,2009-07-03,Donald Munro,False,2.5/5,rotten,Eye for Film,,NEGATIVE,http://www.eyeforfilm.co.uk/reviews.php?id=8285
1194515-ice_age_dawn_of_the_dinosaurs,1830415,2009-07-03,James Dyer,True,3/5,fresh,Empire Magazine,"It's a pacey, enjoyable yarn for the most part, but the franchise's key strength is its characters and the relationships, tired by part two, are seriously running out of steam.",POSITIVE,http://www.empireonline.com/reviews/ReviewComplete.asp?FID=135378
1194515-ice_age_dawn_of_the_dinosaurs,1830386,2009-07-03,David Edwards,False,3/5,fresh,Daily Mirror (UK),Ice Age part three - a competent water-treader which use a cast of cutesy animals to disguise their lack of ambition.,POSITIVE,http://blogs.mirror.co.uk/the-ticket/2009/07/film-review-ice-age-dawn-of-th.html
1194515-ice_age_dawn_of_the_dinosaurs,1830385,2009-07-03,Mark Adams,False,4/5,fresh,Sunday Mirror (UK),The laughs are balanced with some outstanding action sequences.,POSITIVE,http://www.mirror.co.uk/tv-entertainment/film/film-reviews/mark-adams/2009/06/28/film-review-ice-age-dawn-of-the-dinosaurs-115875-21478741/
1194515-ice_age_dawn_of_the_dinosaurs,1830376,2009-07-03,Nigel Andrews,True,,rotten,Financial Times,"Even the little boy in the second row, dragged along by a parent for a treat, was frozen in silence, victim of that cyclical ice age that affects audiences powerless to fend off the cryogenic effect of a sub-zero digimation romp.",NEGATIVE,http://www.ft.com/cms/s/2/1f7d4b94-6660-11de-a034-00144feabdc0.html
1194515-ice_age_dawn_of_the_dinosaurs,1830367,2009-07-03,Robert Hanks,True,3/5,fresh,Independent (UK),"It's not nearly as funny or as cute as it needs to be, but it will do as holiday entertainment for children who liked the first two and have reasonably short memories.",POSITIVE,http://www.independent.co.uk/arts-entertainment/films/reviews/ice-age-3-dawn-of-the-dinosaurs-u-1729317.html
1194515-ice_age_dawn_of_the_dinosaurs,1830361,2009-07-03,Allan Hunter,False,,fresh,Daily Express (UK),It isn't as fresh or as funny as the earlier Ice Age animated features but then it doesn't embarrass its predecessors either.,POSITIVE,http://www.express.co.uk/features/view/111504/Mammoth-fun-for-all-the-family
1194515-ice_age_dawn_of_the_dinosaurs,1830357,2009-07-03,Larushka Ivan-Zadeh,True,3/5,fresh,Metro Newspaper (UK),"The trademark Loony Toon-lite slapstick undeniably compensates for a bitty, unmemorable plot that stampedes along like a mammoth through chewing gum.",POSITIVE,http://www.metro.co.uk/metrolife/films/article.html?Ice_Age_3_boasts_amazing_3-D_visuals&in_article_id=696258&in_page_id=27
1194515-ice_age_dawn_of_the_dinosaurs,1830354,2009-07-03,Derek Malcolm,True,3/5,fresh,London Evening Standard,"Though there's not much of a story, the animation is expert and imaginative.",POSITIVE,
1194515-ice_age_dawn_of_the_dinosaurs,1830350,2009-07-03,Matthew Turner,False,3/5,fresh,ViewLondon,"This is beautifully animated and stays watchable thanks to its likeable cast of characters, but it's never as funny as it should be and the 3D effects are under-used.",POSITIVE,http://www.viewlondon.co.uk/films/ice-age-3-dawn-of-the-dinosaurs-film-review-28868.html
1194515-ice_age_dawn_of_the_dinosaurs,1830347,2009-07-03,Robbie Collin,True,4/5,fresh,News of the World,An hour-and-a-half feast of laughs and slapstick action that only the most jaded film snob could resist.,POSITIVE,http://www.newsoftheworld.co.uk/entertainment/film/378384/Ice-Age-3-U-Voices-by-Simon-Pegg-and-Queen-Latifah.html
1194515-ice_age_dawn_of_the_dinosaurs,1830344,2009-07-03,Grant Lauchlan,False,3/5,fresh,Daily Record (UK),After a bit of a slow start the film certainly picks up the slack with a boundless sense of fun and visual energy.,POSITIVE,
1194515-ice_age_dawn_of_the_dinosaurs,1830343,2009-07-03,Alistair Harkness,False,2/5,rotten,Scotsman,Ice Age 3 has the pacing of a glacier and the warmth of one too. That's something an extra dimension just can't overcome.,NEGATIVE,http://living.scotsman.com/movies/Film-review-Ice-Age-3.5425632.jp
1194515-ice_age_dawn_of_the_dinosaurs,1830337,2009-07-03,Kit Bowen,False,2/4,rotten,The Movie Kit,Thaw out in Jurassic Park with the fun-lovin' Ice Age gang %u2013 and throw all logic out the window.,NEGATIVE,http://themoviekit.com/?p=599
1194515-ice_age_dawn_of_the_dinosaurs,1830335,2009-07-02,Todd Hertz,False,3/4,fresh,Christianity Today,Reminded me of the simple fun of old Bugs Bunny cartoons. And that's what Ice Age: Dawn of the Dinosaurs is able to accomplish%u2014a sense of good old fun.,POSITIVE,http://www.christianitytoday.com/movies/reviews/2009/iceage3.html
1194515-ice_age_dawn_of_the_dinosaurs,1830330,2009-07-02,Margaret Pomeranz,False,2.5/5,rotten,At the Movies (Australia),The lack of real wit in this became a bit tedious.,NEGATIVE,
1194515-ice_age_dawn_of_the_dinosaurs,1830329,2009-07-02,David Stratton,True,2.5/5,rotten,At the Movies (Australia),"The animation, by Fox's Blue Sky studio, still impresses, especially in the care given to the fur on the creatures; but the humour seems even more aimed at the very young than before.",NEGATIVE,
1194515-ice_age_dawn_of_the_dinosaurs,1830323,2009-07-02,Sandra Hall,True,,rotten,Sydney Morning Herald,And that overriding air of cuteness is a problem that seems destined to get worse in the sequels which will surely follow. Battle fatigue has definitely set in.,NEGATIVE,http://www.smh.com.au/news/entertainment/film/film-reviews/ice-age-3-dawn-of-the-dinosaurs/2009/07/02/1246127614570.html
1194515-ice_age_dawn_of_the_dinosaurs,1830318,2009-07-02,Julie Rigg,False,,fresh,"MovieTime, ABC Radio National","Look it won't do much for your children's ideas of natural history, but it's fun. It's proving quite a durable animated series.",POSITIVE,http://www.abc.net.au/rn/movietime/stories/2009/2614703.htm
1194515-ice_age_dawn_of_the_dinosaurs,1830315,2009-07-02,Ben McEachen,False,4/5,fresh,Daily Telegraph (Australia),A fun-tastic adventure that virtually guarantees enjoyment for the whole family.,POSITIVE,http://guides.news.com.au/movies/movie/?title_id=37360&review=77734
1194515-ice_age_dawn_of_the_dinosaurs,1830310,2009-07-02,Vicky Roach,False,3.5/5,fresh,Courier Mail (Australia),"Dawn of the Dinosaurs so successfully reinvigorates an already solid franchise, while simultaneously broadening the fan base, that you can already see the fourth film gathering on the horizon.",POSITIVE,http://guides.news.com.au/couriermail/movies/movie/?title_id=37360&review=77670
1194515-ice_age_dawn_of_the_dinosaurs,1830286,2009-07-02,Claudia Puig,True,2/4,rotten,USA Today,"Rather than evolving, Ice Age: Dawn of the Dinosaurs treads on familiar and infertile ground.",NEGATIVE,http://www.usatoday.com/life/movies/reviews/2009-06-30-ice-age-dawn-of-the-dinosaurs_N.htm
1194515-ice_age_dawn_of_the_dinosaurs,1830285,2009-07-02,Joe Morgenstern,True,,rotten,Wall Street Journal,"There's a sense of ineptness in a script that constantly reaches, with only modest success, for amusing things that the mammoths and their friends can do.",NEGATIVE,http://online.wsj.com/page/2_1168.html?mod=2_1168
1194515-ice_age_dawn_of_the_dinosaurs,1830266,2009-07-02,Gary Wolcott,False,4/5,fresh,Tri-City Herald,Director Carlos Saldanha finally gets it right and is able to give some life to an animated concept that really should have died out with the last ice age.,POSITIVE,http://www.tri-cityherald.com/1190/story/632996.html
1194515-ice_age_dawn_of_the_dinosaurs,1830235,2009-07-02,James Rocchi,True,2.5/5,rotten,MSN Movies,"There are chases and escapes, morals and messages, comedy and character... but when the fur stops flying, it still feels more frozen than fresh.",NEGATIVE,http://movies.msn.com/movies/movie-critic-reviews/ice-age-dawn-of-the-dinosaurs/
1194515-ice_age_dawn_of_the_dinosaurs,1830191,2009-07-02,Rob Vaux,False,C,rotten,Mania.com,"In a year that has produced the likes of Up and Coraline, Dawn of the Dinosaurs counters with nothing but energetic mediocrity...",NEGATIVE,http://www.mania.com/ice-age-dawn-dinosaurs-review_article_116028.html
1194515-ice_age_dawn_of_the_dinosaurs,1830124,2009-07-01,Sara Michelle Fetters,True,2.5/4,fresh,MovieFreak.com,"Returning to the core basics that made the 2002 original a surprise smash, by and large this pleasing third chapter in the popular franchise hits a lot of right notes which kept me more or less amused.",POSITIVE,http://www.moviefreak.com/artman/publish/movies_iceage3.shtml
1194515-ice_age_dawn_of_the_dinosaurs,1830118,2009-07-01,Keith Cohen,False,3/4,fresh,Entertainment Spectrum,This fun and exciting crowd-pleaser generates lots of laugh-out-loud moments. Kids will be able to identify with the distinct personalities of these familiar lovable characters.,POSITIVE,http://www.entertainmentspectrum.com/index/movies/942/iceagedawnofthedinosaurs.html
1194515-ice_age_dawn_of_the_dinosaurs,1830080,2009-07-01,Avi Offer,False,5.5/10,rotten,NYC Movie Guru,"Has stunning animation and manages to be mildly amusing, but it fails to entertain kids and adults simultaneously and feels mostly lazy and uninspired with insufficient laughs and thrills.",NEGATIVE,http://www.nycmovieguru.com/july1st09.html#iceage3
1194515-ice_age_dawn_of_the_dinosaurs,1830078,2009-07-01,Dan Lybarger,False,2.5/4,rotten,eFilmCritic.com,The film's story is so dry and unimaginative that it appears to have been preserved in amber from an earlier era.,NEGATIVE,http://www.kcactive.com/aande/reel/0709_reel.htm#ice
1194515-ice_age_dawn_of_the_dinosaurs,1830076,2009-07-01,Michael O'Sullivan,True,,rotten,Washington Post,"It's not utterly without charm. Only here, that charm feels less earned than manufactured, a product not of evolution -- or even intelligent design -- but of cynical, soulless opportunism.",NEGATIVE,http://www.washingtonpost.com/wp-dyn/content/article/2009/06/30/AR2009063003821.html
1194515-ice_age_dawn_of_the_dinosaurs,1830067,2009-07-01,Fred Topel,False,,fresh,Can Magazine,"A return to form from the original Ice Age. That makes it a disappointment. The first one was okay. Ice Age: The Meltdown was pretty good, and now we're back to the original mediocrity.",POSITIVE,http://www.canmag.com/nw/14287-ice-age-dawn-dinosaurs-review
1194515-ice_age_dawn_of_the_dinosaurs,1830062,2009-07-01,Rob Thomas,False,2.5/4,rotten,"Capital Times (Madison, WI)","It's not much more than a ride; the plot is thin, the characters aren't very engaging, and it just lacks that storytelling spark that Pixar movies have year after year.",NEGATIVE,http://77square.com/movies/reviews/story_456861
1194515-ice_age_dawn_of_the_dinosaurs,1830057,2009-07-01,Liz Braun,False,2/5,rotten,Jam! Movies,Remember how terrific the original Ice Age movie was? That was then. This is now. Alas.,NEGATIVE,
1194515-ice_age_dawn_of_the_dinosaurs,1830056,2009-07-01,Elizabeth Weitzman,True,3/5,fresh,New York Daily News,This rambunctious outing -- the third in the franchise -- is cute enough to engage kids and just smart enough to keep the chaperones entertained.,POSITIVE,http://www.nydailynews.com/entertainment/movies/2009/07/01/2009-07-01_fun_is_far_from_extinct.html
1194515-ice_age_dawn_of_the_dinosaurs,1830051,2009-07-01,Graham Killeen,False,2/4,rotten,Milwaukee Journal Sentinel,"Countless escapades through logs, massive dino-rib-cages, and cracks in the frozen tundra never quite justify the movie's use of 3-D, however. The children sitting next to me in the theater jettisoned their cumbersome glasses right away.",NEGATIVE,http://www.jsonline.com/entertainment/movies/49564707.html
1194515-ice_age_dawn_of_the_dinosaurs,1830048,2009-07-01,Peter Hartlaub,True,2/4,rotten,Houston Chronicle,"If the third Ice Age were a bit better, there would be little need to dwell on the inconsistencies.",NEGATIVE,http://www.chron.com/disp/story.mpl/ent/movies/reviews/6505363.html
1194515-ice_age_dawn_of_the_dinosaurs,1830040,2009-07-01,Luke Y. Thompson,False,D+,rotten,E! Online,About as exciting as watching snow melt.,NEGATIVE,http://www.eonline.com/uberblog/movie_reviews/b132220_review_ice_age_critters_lose_their_edge.html
1194515-ice_age_dawn_of_the_dinosaurs,1830039,2009-07-01,Tom Long,True,C,rotten,Detroit News,Nobody seems to be working too hard in Ice Age: Dawn of the Dinosaurs.,NEGATIVE,http://www.detnews.com/article/20090701/ENT02/907010309/1034/ent02/-Ice-Age--plot-is-old-as-hills
1194515-ice_age_dawn_of_the_dinosaurs,1830029,2009-07-01,Sean O'Connell,False,2/4,rotten,Charlotte Weekly,The third time's less of a charm and more of a thin attempt to cash in on the success of the previous installments.,NEGATIVE,
1194515-ice_age_dawn_of_the_dinosaurs,1830028,2009-07-01,Joe Williams,True,,rotten,St. Louis Post-Dispatch,"With its three-dimensional action and two-dimensional feelings, Ice Age: Dawn of the Dinosaurs is warmed-over nonsense.",NEGATIVE,
1194515-ice_age_dawn_of_the_dinosaurs,1830024,2009-07-01,Chris Hewitt,False,2.5/4,fresh,St. Paul Pioneer Press,"There are so many confusing things about the title, Ice Age: Dawn of the Dinosaurs, that your best bet is to forget it and enjoy.",POSITIVE,
1194515-ice_age_dawn_of_the_dinosaurs,1830022,2009-07-01,Owen Gleiberman,True,B-,fresh,Entertainment Weekly,"Nice, sweet, safe.",POSITIVE,"http://www.ew.com/ew/article/0,,20288637,00.html"
1194515-ice_age_dawn_of_the_dinosaurs,1830019,2009-07-01,Lisa Kennedy,True,2.5/4,fresh,Denver Post,The finest idiosyncratic pleasure of this franchise remains the ongoing relationship of hapless squirrel-rat Scrat to his beloved acorn.,POSITIVE,
1194515-ice_age_dawn_of_the_dinosaurs,1830014,2009-07-01,Tom Maurstad,True,4.5/5,fresh,Dallas Morning News,"This is true family fun. Not the two-tiered sort where there are potty jokes for the kids and pop culture references for the parents. Not only will everyone be laughing at the same time, they'll be laughing at the same things.",POSITIVE,
1194515-ice_age_dawn_of_the_dinosaurs,1830008,2009-07-01,Keith Phipps,True,C+,rotten,AV Club,"What follows: crude jokes, sweet lessons, Simon Pegg as an adventurer gone insane, and a bunch of decent animation, which select patrons will see in impressive 3-D. Ideally they'll be about 8 years old and hopped up on Junior Mints.",NEGATIVE,
1194515-ice_age_dawn_of_the_dinosaurs,1830004,2009-07-01,Vadim Rizov,True,2/5,rotten,Time Out,"Lacking even the briefest flicker of a joke not culled from the fart-gag, pop-cultural-reference grab bag, the latest installment in Fox's most durable kiddie franchise offers unreasonably devoted parents less than usual to look forward to.",NEGATIVE,http://www.timeout.com/film/newyork/reviews/87288/ice_age_3-dawn_of_the_dinosaurs.html
1194515-ice_age_dawn_of_the_dinosaurs,1830002,2009-07-01,Peter Howell,True,3/4,fresh,Toronto Star,"This third trip to the Ice Age cooler should delight families with its amusing new dino buddies, even as it risks terrifying tots.",POSITIVE,http://www.thestar.com/entertainment/article/659214
1194515-ice_age_dawn_of_the_dinosaurs,1829999,2009-07-01,Willie Waffle,False,2/4,rotten,WaffleMovies.com,"Doesn't come close to the emotion, imagination or entertainment value of something like Up.",NEGATIVE,"http://www.dc50tv.com/entertainment/movies/wdcw-willie-waffle-iceage3,0,47567.htmlstory"
