id,reviewId,creationDate,criticName,isTopCritic,originalScore,reviewState,publicatioName,reviewText,scoreSentiment,reviewUrl
star_wars_episode_iii_revenge_of_the_sith,1395327,2005-05-22,Jonathan Rosenbaum,True,3/4,fresh,Chicago Reader,"Lucas has woven into the action and effects a relatively thoughtful story about a young man meant for greatness but corrupted by his own fear and confusion, a story more Shakespearean than Arthurian.",POSITIVE,http://www.chicagoreader.com/chicago/mr-lucas-goes-to-washington/Content?oid=918893
star_wars_episode_iii_revenge_of_the_sith,1394732,2005-05-21,Dan Fienberg,True,3/4,fresh,Zap2it.com,"Hardly the masterpiece that anxious fanboys have rushed to call it, Sith recovers much of the joy and the gravity that many feared had gone the way of the Ewoks.",POSITIVE,http://www.zap2it.com/movies/go?path=/movies/movies/reviews/text&general_id=25772
star_wars_episode_iii_revenge_of_the_sith,1394726,2005-05-21,Jean Lowerison,False,,rotten,San Diego Metropolitan,The good news is that Lucas promises this is the last Star Wars movie. Hallelujah.,NEGATIVE,http://sandiegometro.archives.whsites.net/reel/index.php?reelID=815
star_wars_episode_iii_revenge_of_the_sith,1394729,2005-05-21,Peter Keough,False,3/4,fresh,Boston Phoenix,"Maybe Revenge of the Sith is the best film in the series because it's the last, and the adventure of a long time ago in a galaxy far, far away returns, inevitably, to the here and now.",POSITIVE,http://www.bostonphoenix.com/boston/movies/documents/04699007.asp
star_wars_episode_iii_revenge_of_the_sith,1394727,2005-05-21,Eric Lurio,False,3.5/5,fresh,Greenwich Village Gazette,"We always knew it would end like this, but sheesh!",POSITIVE,
star_wars_episode_iii_revenge_of_the_sith,1394728,2005-05-21,Marty Mapes,False,3/4,fresh,Movie Habit,One leaves the theater with a 30-year sense of closure and satisfaction,POSITIVE,http://www.moviehabit.com/reviews/sta_er05.shtml
star_wars_episode_iii_revenge_of_the_sith,1394616,2005-05-20,David Cornelius,False,5/5,fresh,eFilmCritic.com,"This is downright brilliant filmmaking, an awesome spectacle that manages to balance thrills and emotion with a steady hand.",POSITIVE,http://efilmcritic.com/review.php?movie=12284&reviewer=392
star_wars_episode_iii_revenge_of_the_sith,1394608,2005-05-20,Victoria Alexander,False,,fresh,Movie Reviews in Croatian,Enthralling and stunning. So it comes down to this: Darth Vader had a selfless good reason.,POSITIVE,
star_wars_episode_iii_revenge_of_the_sith,1394607,2005-05-20,Pablo Villaça,False,5/5,fresh,Cinema em Cena,"A Vingana dos Sith engrandece toda a saga concebida por George Lucas. Esta , com o perdo do trocadilho, sua verdadeira Fora.",POSITIVE,http://www.cinemaemcena.com.br/Ficha_filme.aspx?aba=critica&id_filme=1803
star_wars_episode_iii_revenge_of_the_sith,1394604,2005-05-20,Eugene Novikov,False,B+,fresh,Film Blather,"It's exciting, foreboding, grand and important, a part of our culture and identity no matter how loudly cineastes scream bloody murder.",POSITIVE,http://filmblather.com/films/revengeofthesith/
star_wars_episode_iii_revenge_of_the_sith,1394544,2005-05-20,Greg Maki,False,3.5/4,fresh,"Star-Democrat (Easton, MD)",The prequel trilogy finally becomes what we have all wanted it to be.,POSITIVE,http://www.stardem.com/article.asp?article=5010&paper=1&cat=142
star_wars_episode_iii_revenge_of_the_sith,1394527,2005-05-20,Jeff Vice,False,3/4,fresh,Deseret News (Salt Lake City),"The action is pretty spectacular, especially the climactic light-saber duel and an all-too-brief sequence in which Yoda leads a Wookiee army into battle. Die-hard fans will be drooling all over that one.",POSITIVE,http://www.deseretnews.com/article/700003843/Star-Wars-Episode-III--Revenge-of-the-Sith.html
star_wars_episode_iii_revenge_of_the_sith,1394473,2005-05-20,Anthony Quinn,True,1/5,rotten,Independent (UK),"Oh, the relief to reach the conclusion of Star Wars Episode III, not because George Lucas has brought home the franchise safe and sound but because I know I will never have to sit through another minute of this turgid, subliterate spaceballs again.",NEGATIVE,http://www.independent.co.uk/arts-entertainment/films/reviews/star-wars-episode-iii-revenge-of-the-sith-12a-491261.html
star_wars_episode_iii_revenge_of_the_sith,1394474,2005-05-20,Robert Denerstein,True,B,fresh,Denver Rocky Mountain News,"If you've seen the others, you'll want to see this one. Let's face it -- there's no turning back.",POSITIVE,
star_wars_episode_iii_revenge_of_the_sith,1394468,2005-05-20,Boo Allen,False,,fresh,Denton Record-Chronicle,Anakin switches teams and the force avoids becoming farce in Lucas' swan-song.,POSITIVE,
star_wars_episode_iii_revenge_of_the_sith,1394459,2005-05-20,Sean Burns,False,,fresh,Philadelphia Weekly,"Growing up Star Wars is like growing up Catholic- no matter how bitter you might become, ya can't shake it. Last week I bought CHEEZ-ITs because R2-D2 was on the box.",POSITIVE,
star_wars_episode_iii_revenge_of_the_sith,1394455,2005-05-20,Tim Robey,True,,rotten,Daily Telegraph (UK),Like the most heavily-effects-budgeted shoulder shrug in history.,NEGATIVE,http://www.telegraph.co.uk/film/star-wars-episode-iii--revenge-of-the-sith/review/
star_wars_episode_iii_revenge_of_the_sith,1394386,2005-05-20,Anton Bitel,False,,fresh,Movie Gazette,"Everything that has a beginning has a middle - and while this centerpiece to the Star Wars saga may indeed be middling, it still beats Return of the Jedi anyday.",POSITIVE,http://www.movie-gazette.com/cinereviews/1057
star_wars_episode_iii_revenge_of_the_sith,1394384,2005-05-20,Peter Bradshaw,True,1/5,rotten,Guardian,"No magic, little light, but an awful lot of heavy industry.",NEGATIVE,"http://film.guardian.co.uk/News_Story/Critic_Review/Guardian_Film_of_the_week/0,4267,1482359,00.html"
star_wars_episode_iii_revenge_of_the_sith,1394365,2005-05-19,Dennis Schwartz,False,B+,fresh,Dennis Schwartz Movie Reviews,Redeems some of the luster lost from the previous two installments.,POSITIVE,https://dennisschwartzreviews.com/starwarsepisode111/
star_wars_episode_iii_revenge_of_the_sith,1394298,2005-05-19,Jonathan R. Perry,False,4/4,fresh,Tyler Morning Telegraph (Texas),"A glorious, perversely satisfying conclusion to a labor of love ... and a grand entertainment in its own right.",POSITIVE,
star_wars_episode_iii_revenge_of_the_sith,1394296,2005-05-19,Mike McGranaghan,False,4/4,fresh,Aisle Seat,"There's some sadness knowing that the Star Wars pictures are done. However, I get intense pleasure knowing that the series concludes on the highest of high notes.",POSITIVE,www.geocities.com/gamut_mag/sith.htm
star_wars_episode_iii_revenge_of_the_sith,1394291,2005-05-19,Luke Y. Thompson,False,,fresh,New Times,"If the final scenes -- and especially the very last shot -- stir nothing within you, chances are you didn't like Star Wars that much to begin with.",POSITIVE,http://www.clevescene.com/cleveland/sith-is-it/Content?oid=1490721
star_wars_episode_iii_revenge_of_the_sith,1394280,2005-05-19,Michael Szymanski,False,4.5/5,fresh,Wordmag.com,The Force will undoubtedly be with us -- and the movie world -- for good...,POSITIVE,
star_wars_episode_iii_revenge_of_the_sith,1394279,2005-05-19,Josh Bell,False,2.5/5,rotten,Las Vegas Weekly,"There is nothing fun about Sith, except maybe the opening space battle, and it's not so much an adventure as an ordeal.",NEGATIVE,http://www.lasvegasweekly.com/news/archive/2005/may/19/star-bores/
star_wars_episode_iii_revenge_of_the_sith,1394248,2005-05-19,Bob Bloom,False,,fresh,"Journal and Courier (Lafayette, IN)","Revenge of the Sith is the darkest, most tragic film in the series. It is also the finest since The Empire Strikes Back.",POSITIVE,
star_wars_episode_iii_revenge_of_the_sith,1394247,2005-05-19,Gregory Weinkauf,False,,fresh,ÜberCiné,"Way-neato Sith is, but its screenplay's logic I understand not.",POSITIVE,http://www.ubercine.com/StarWarsEpisodeIII-GW.html
star_wars_episode_iii_revenge_of_the_sith,1394239,2005-05-19,Jimmy O,False,4/5,fresh,Film Snobs,"""Hey, you got politics all over my mythology!"" ""No, you got mythology all over my politics!"" Guess what? You can have both!",POSITIVE,http://www.filmsnobs.com/index.php?nowShowing=reviews&by=jimmyO&id=173
star_wars_episode_iii_revenge_of_the_sith,1394218,2005-05-19,Mark Collette,False,4/4,fresh,Tyler Morning Telegraph (Texas),It turns out I'm still afraid of the Dark Side.,POSITIVE,
star_wars_episode_iii_revenge_of_the_sith,1394211,2005-05-19,Timothy Knight,False,2/4,rotten,Reel.com,"There's precious little of the wonder and charm of the original Stars Wars films in this big, loud, and mostly empty spectacle.",NEGATIVE,
star_wars_episode_iii_revenge_of_the_sith,1394209,2005-05-19,David Sterritt,False,B,fresh,Christian Science Monitor,"When the aim is pure visual spectacle, the results are brilliantly exciting. When the aim is heart-touching drama, though, the movie falls apart.",POSITIVE,http://www.csmonitor.com/2005/0519/p12s01-almo.html
star_wars_episode_iii_revenge_of_the_sith,1394204,2005-05-19,Scott Collura,False,B+,fresh,Now Playing Magazine,It's revenge of the Star Wars fan.,POSITIVE,http://www.nowplayingmag.com/content/view/1534/47/
star_wars_episode_iii_revenge_of_the_sith,1394176,2005-05-19,John Wirt,False,,rotten,"Advocate (Baton Rouge, LA)",Flat performances and even flatter dialogue give the final Star Wars prequel a hollow ring.,NEGATIVE,
star_wars_episode_iii_revenge_of_the_sith,1394174,2005-05-19,Scott Foundas,False,,fresh,L.A. Weekly,"The lurid attraction of Revenge of the Sith stems from its utter predictability, from our knowledge that this is the payoff for which five earlier films over 28 years were but one elaborate Greek chorus.",POSITIVE,http://www.laweekly.com/film/seems-like-old-times-2139958
star_wars_episode_iii_revenge_of_the_sith,1394173,2005-05-19,Emily Blunt,False,4/4,fresh,Blunt Review,Be still our little saber-loving hearts! It's here...,POSITIVE,http://www.bluntreview.com/reviews/starwars3.html
star_wars_episode_iii_revenge_of_the_sith,1394172,2005-05-19,Nick Rogers,False,3.5/4,fresh,The Film Yap,"It's the only new prequel that doesn't feel like robots were behind the camera, and the most thrilling, enthralling and tragic episode since Empire.",POSITIVE,http://www.thefilmyap.com/movies/revenge-of-the-sith/
star_wars_episode_iii_revenge_of_the_sith,1394170,2005-05-19,Kit Bowen,False,3/4,fresh,Hollywood.com,"If you can use Jedi mind tricks to gloss over the trite dialogue and stiff acting, Revenge of the Sith is going to give you the big payoff you've been waiting for.",POSITIVE,http://www.hollywood.com/review/Star_Wars_Episode_IIIRevenge_of_the_Sith/2440725
star_wars_episode_iii_revenge_of_the_sith,1394166,2005-05-19,Carol Cling,False,A,fresh,Las Vegas Review-Journal,"The Force will be with us always -- and, after seeing Revenge of the Sith, you'll once again remember why.",POSITIVE,http://www.reviewjournal.com/lvrj_home/2005/May-19-Thu-2005/living/1697797.html
star_wars_episode_iii_revenge_of_the_sith,1394157,2005-05-19,Cherryl Dawson and Leigh Ann Palone,False,3.5/5,fresh,TheMovieChicks.com,"I got frustrated with the high cheesy factor (disappointed in the acting I was), but I never got bored.",POSITIVE,http://www.themoviechicks.com/mid2005/mcrstarwars3.html
star_wars_episode_iii_revenge_of_the_sith,1394156,2005-05-19,Jeffrey M. Anderson,False,3.5/4,fresh,Combustible Celluloid,"Star Wars: Episode III - Revenge of the Sith is the movie we've been waiting for, the movie that should have been made all along.",POSITIVE,http://www.combustiblecelluloid.com/2005/swsith.shtml
star_wars_episode_iii_revenge_of_the_sith,1394154,2005-05-19,John Beifuss,False,'3.5/4',fresh,"Commercial Appeal (Memphis, TN)","For once, the words 'A long time ago in a galaxy far, far away' seem ironic, and it's hard to watch what follows without drawing comparisons to our own political landscape.",POSITIVE,
star_wars_episode_iii_revenge_of_the_sith,1394153,2005-05-19,Kevin A. Ranson,False,3.5/4.0,fresh,MovieCrypt.com,"Limbs are lost, people die, destruction is widespread, and evil reigns... all this violence is courtesy a mere PG-13 rating (thanks, MPAA!)",POSITIVE,http://moviecrypt.com/?p=446
star_wars_episode_iii_revenge_of_the_sith,1394152,2005-05-19,Michelle Alexandria,False,A-,fresh,Eclipse Magazine,Got Wood? Christensen's stiff acting almost sink this digital ship. The last hour is absolutely brilliant.,POSITIVE,http://www.eclipsemagazine.com/modules/news/article.php?storyid=1373
star_wars_episode_iii_revenge_of_the_sith,1394151,2005-05-19,Paul Salfen,False,8/10,fresh,Supercala.com,"This one is definitely the best of the three. Fear not, fans. Lucas came through in the clutch.",POSITIVE,http://www.supercalafragalistic.com/revengeofthesithreview2.htm
star_wars_episode_iii_revenge_of_the_sith,1394150,2005-05-19,Sean P. Means,False,3.5/4,fresh,Salt Lake Tribune,"It's meatier and more daring than [the first two prequels], and earns its place alongside the original Star Wars and The Empire Strikes Back.",POSITIVE,http://www.sltrib.com/ci_2744773
star_wars_episode_iii_revenge_of_the_sith,1394147,2005-05-19,Cynthia Fuchs,False,,rotten,PopMatters,"Lucas' attempted apolitical veneer only underlines the point: wars are political, even in movies.",NEGATIVE,http://popmatters.com/film/reviews/s/star-wars-episode-3.shtml
star_wars_episode_iii_revenge_of_the_sith,1394146,2005-05-19,Jeffrey Bruner,False,3/5,rotten,Des Moines Register,Too bad George Lucas was trying to write a tragedy and not a farce.,NEGATIVE,http://www.dmregister.com/apps/pbcs.dll/article?AID=/20050519/ENT03/505190366/1049
star_wars_episode_iii_revenge_of_the_sith,1394145,2005-05-19,Collin Souter,False,3/4,fresh,eFilmCritic.com,"While it does carry some of the flaws of the first two episodes, it thankfully lives up to its promise to be the darkest film in the series.",POSITIVE,http://efilmcritic.com/review.php?movie=12284&reviewer=233
star_wars_episode_iii_revenge_of_the_sith,1394144,2005-05-19,Jeremy C. Fox,False,,fresh,Pajiba,"Lucas should be barred from touching a typewriter, but, based on his work here, I'd like to see him encouraged to shoot as many fight scenes as possible.",POSITIVE,http://www.pajiba.com/film_reviews/star-wars-episode-iii-revenge-of-the-sith.php
star_wars_episode_iii_revenge_of_the_sith,1394143,2005-05-19,David Keyes,False,3/4,fresh,Cinemaphile.org,"An ideal, convincing finale for this franchise.",POSITIVE,http://cinemaphile.org/reviews/2005/starwarsepisode3.html
star_wars_episode_iii_revenge_of_the_sith,1394113,2005-05-19,Susan Tavernetti,False,3/4,fresh,Palo Alto Weekly,"Lucas' vision has matured, along with his digital special-effects tools. Lucky for us that the Force was often with him on this one.",POSITIVE,https://web.archive.org/web/20050605083421/http://www.paloaltoonline.com/movies/cgi/moviescreener_long.cgi?id=2175
star_wars_episode_iii_revenge_of_the_sith,1394103,2005-05-19,Andy Klein,False,,rotten,Los Angeles CityBeat,...falls down in the one area that it can't afford to - making us feel something at the moment Anakin goes to the Dark Side.,NEGATIVE,
star_wars_episode_iii_revenge_of_the_sith,1394090,2005-05-19,Bob Grimm,False,4.5/5,fresh,Sacramento News & Review,The circle is now complete.,POSITIVE,http://www.newsreview.com/sacramento/Content?oid=35483
star_wars_episode_iii_revenge_of_the_sith,1394086,2005-05-18,Eric D. Snider,False,B+,fresh,EricDSnider.com,"Almost exactly what it needs to be, a powerful middle film to end one trilogy and presage another.",POSITIVE,http://www.ericdsnider.com/movies/star-wars-episode-iii-revenge-of-the-sith/
star_wars_episode_iii_revenge_of_the_sith,1394085,2005-05-18,Dustin Putman,False,3/4,fresh,TheFilmFile.com,"A slam-bang summer blockbuster. Completes, deepens, and enriches the series beyond the pop-cultural phenomenon it has long-since made for itself.",POSITIVE,http://themovieboy.com/directlinks/05starwars3.htm
star_wars_episode_iii_revenge_of_the_sith,1394084,2005-05-18,Karina Montgomery,False,4/5,fresh,Cinerina,"Acquits the recent stinkiness of the series pretty well. I know, high praise indeed. But consider this - I knew what was going to happen, and I still cared.",POSITIVE,http://ensim.streamstudiohost.net/~cinerina.com/reviews/archives/000716.html
star_wars_episode_iii_revenge_of_the_sith,1394078,2005-05-18,Phil Villarreal,False,4/4,fresh,Arizona Daily Star,"Beautifully choreographed, loud, furious and rib-shaking donnybrooks that are weaved of the long-gestating daydreams of fans.",POSITIVE,http://www.azstarnet.com/sn/starwars/74852.php
star_wars_episode_iii_revenge_of_the_sith,1394073,2005-05-18,Todd Gilchrist,False,,rotten,FilmStew.com,"Remarkably, Lucas solicits even worse performances than in pictures past; the Mace Windu-Palpatine confrontation ranks amongst the worst acted scenes I've ever seen.",NEGATIVE,http://www.filmstew.com/Content/Article.asp?Pg=1&ContentID=11541
star_wars_episode_iii_revenge_of_the_sith,1394071,2005-05-18,Willie Waffle,False,5/4,fresh,WaffleMovies.com,The only disappointment - Natalie Portman does not wear the Princess Leia gold bikini.,POSITIVE,http://www.wafflemovies.com/starwars3.html
star_wars_episode_iii_revenge_of_the_sith,1394068,2005-05-18,Kevin Carr,False,5/5,fresh,7M Pictures,"Revenge of the Sith is so good, it almost redeems Episode I... Almost.",POSITIVE,http://www.7mpictures.com/inside/reviews/starwars3_review.htm
star_wars_episode_iii_revenge_of_the_sith,1394042,2005-05-18,Erik Childress,False,4/4,fresh,eFilmCritic.com,Not only a perfect bridge to the original trilogy but will draw favorable comparisons to the fabled excellence of The Empire Strikes Back.,POSITIVE,http://efilmcritic.com/review.php?movie=12284&reviewer=198
star_wars_episode_iii_revenge_of_the_sith,1394025,2005-05-18,Nell Minow,True,B,fresh,Movie Mom,"George Lucas is much more interested in the reflection of some planet's third moon on a window than in the other reasons people go to movies, like acting and script.",POSITIVE,
star_wars_episode_iii_revenge_of_the_sith,1394014,2005-05-18,Jon Niccum,False,3/4,fresh,Lawrence Journal-World,"The film is pretty much wall-to-wall action, with little of the filibusters about trade unions that made Phantom Menace and Clones so irritating.",POSITIVE,http://www.lawrence.com/news/2005/may/18/starwars3/
star_wars_episode_iii_revenge_of_the_sith,1393999,2005-05-18,Nicolas Lacroix,False,3.5/5,fresh,EnPrimeur.ca,"Nostalgie et gravit aidant, La Revanche des Sith offre certainement quelques squences d'anthologie et mme certains moments d'motion palpable.",POSITIVE,http://www.enprimeur.ca/index.asp?pageID=9&reviews_id=118
star_wars_episode_iii_revenge_of_the_sith,1393998,2005-05-18,Lisa Kennedy,True,3/4,fresh,Denver Post,"Just when you thought it was safe to ridicule everything Star Wars, Lucas returns from his flirtation with the Dark Side by crafting a terrific caper to his monumental series.",POSITIVE,http://www.denverpost.com/entertainment/ci_29255600/episode-iii-revenge-sith-original-star-wars-movie
star_wars_episode_iii_revenge_of_the_sith,1393996,2005-05-18,Peter Watts,True,3/5,rotten,Time Out,"A film that never wields the dramatic impact its plot should demand, and never realises the emotional potential at its dark heart.",NEGATIVE,http://www.timeout.com/film/81595.html
star_wars_episode_iii_revenge_of_the_sith,1393995,2005-05-18,Michael Sragow,False,4/4,fresh,Baltimore Sun,"At its best, Revenge of the Sith reaches that plateau where pop is art.",POSITIVE,http://articles.baltimoresun.com/2005-05-18/features/0505180118_1_george-lucas-anakin-skywalker-hayden-christensen
star_wars_episode_iii_revenge_of_the_sith,1393992,2005-05-18,James O'Ehley,False,,rotten,Sci-Fi Movie Page,"Like the other two so-called 'prequels', this one still doesn't feel like a Star Wars movie . . .",NEGATIVE,http://www.scifimoviepage.com/revengeofsith.html
star_wars_episode_iii_revenge_of_the_sith,1393990,2005-05-18,Matthew Turner,False,4/5,fresh,ViewLondon,"A dark, dramatic, action-packed climax to the trilogy of prequels that's almost good enough to make you forgive The Phantom Menace. Almost.",POSITIVE,http://www.viewlondon.co.uk/films/star-wars-episode-iii-revenge-of-the-sith-film-review-11681.html
star_wars_episode_iii_revenge_of_the_sith,1393971,2005-05-18,Matt Brunson,False,2.5/4,fresh,Creative Loafing,"If only this had gotten out of the starting gate a little quicker, it would be an unqualified success.",POSITIVE,http://charlotte.creativeloafing.com/2005-05-18/film_feature.html
star_wars_episode_iii_revenge_of_the_sith,1393970,2005-05-18,Eric Melin,False,3/4,fresh,Lawrence.com,"Episode III suffers from some of the same shortcomings... that its two recent predecessors did, only this time... far less...",POSITIVE,http://www.lawrence.com/blogs/scenestealers/2005/may/18/episode3/
star_wars_episode_iii_revenge_of_the_sith,1393966,2005-05-18,Annlee Ellingson,False,3.5/5,fresh,Boxoffice Magazine,"While Lord Lucas has failed to solve the problems that he has demonstrated throughout the sextet, he also has commandingly summited the zenith of what he is good at.",POSITIVE,http://pro.boxoffice.com/reviews/2008-08-star-wars-episode-iii-revenge
star_wars_episode_iii_revenge_of_the_sith,1393965,2005-05-18,Stephanie Zacharek,True,,rotten,Salon.com,Revenge of the Sith might be tolerable if it weren't designed to be taken seriously.,NEGATIVE,http://www.salon.com/2005/05/18/star_wars_iii/
star_wars_episode_iii_revenge_of_the_sith,1393963,2005-05-18,Thomas Delapa,False,,rotten,Boulder Weekly,"Otherwise known as I Was a Teenage Darth Vader, Star Wars III is dull, puerile and underwritten, not that it will matter to its lemming-like legion of fans.",NEGATIVE,https://web.archive.org/web/20050622042901/http://www.boulderweekly.com/reeltoreel.html
star_wars_episode_iii_revenge_of_the_sith,1393962,2005-05-18,Geoff Pevere,True,3/4,fresh,Toronto Star,"For fans it will be nirvana, and for everyone else a welcome relief.",POSITIVE,http://WWW.TheStar.COM/NASApp/cs/ContentServer?pagename=thestar/Layout/Article_Type1&c=Article&cid=1116410871812&call_pageid=1022183557980&col=1022183560753
star_wars_episode_iii_revenge_of_the_sith,1393961,2005-05-18,Chris Hewitt,False,3.5/4,fresh,St. Paul Pioneer Press,"'Triumphant' is the word I'd use for Sith, particularly for its superb light-saber battles, which rediscover the sheer joy and physicality missing in Star Wars since Han Solo's heyday.",POSITIVE,
star_wars_episode_iii_revenge_of_the_sith,1393960,2005-05-18,Stephen Hunter,True,,fresh,Washington Post,"Revenge of the Sith is a brilliant consummation to a promise made a long time ago, far, far away, in a galaxy called 1977.",POSITIVE,http://www.washingtonpost.com/wp-dyn/articles/A2017-2005May18.html
star_wars_episode_iii_revenge_of_the_sith,1393959,2005-05-18,Gary Thompson,False,,fresh,Philadelphia Daily News,"Revenge of the Sith, though, stands apart from its inert, tech-obsessed predecessors. It feels, at last, like the work of a man with a story to tell.",POSITIVE,
star_wars_episode_iii_revenge_of_the_sith,1393958,2005-05-18,Mick LaSalle,True,2.5/4,rotten,San Francisco Chronicle,"Watching Revenge of the Sith, it's hard not to wonder if Lucas even knows how good a movie he almost made.",NEGATIVE,http://www.sfgate.com/cgi-bin/article.cgi?f=/c/a/2005/05/18/DDGS4CQ2RR10.DTL
star_wars_episode_iii_revenge_of_the_sith,1393957,2005-05-18,Shawn Levy,False,,fresh,Oregonian,"The darkest, most operatic, and technologically richest Star Wars movie to date, Sith is grim, stirring entertainment and a nearly complete vindication.",POSITIVE,
star_wars_episode_iii_revenge_of_the_sith,1393956,2005-05-18,William Arnold,False,A,fresh,Seattle Post-Intelligencer,The movie grabs us from its heart-pounding opening sequence and pulls us inexorably along its trajectory with the grip of the last gruesome act of a Greek tragedy.,POSITIVE,http://seattlepi.nwsource.com/movies/224635_starwars18q.html
star_wars_episode_iii_revenge_of_the_sith,1393955,2005-05-18,Louis B. Hobson,False,4/5,fresh,Jam! Movies,Compared to the dog-fight in Star Wars this is like playing Halo instead of Pac Man.,POSITIVE,http://jam.canoe.ca/Movies/Reviews/S/Star_Wars_Episode3/2005/05/18/1044526.html
star_wars_episode_iii_revenge_of_the_sith,1393954,2005-05-18,Mark Rahner,True,3.5/4,fresh,Seattle Times,"George Lucas had lost his way for many years, gone to filmmaking's dark side. But now he's mustered up completely unexpected reserve for a last-minute redemption.",POSITIVE,http://www.seattletimes.nwsource.com/html/entertainment/2002278140_starwars18.html
star_wars_episode_iii_revenge_of_the_sith,1393953,2005-05-18,Carla Meyer,False,3/4,fresh,Sacramento Bee,"Though flawed, Episode III never betrays the Star Wars legacy.",POSITIVE,
star_wars_episode_iii_revenge_of_the_sith,1393952,2005-05-18,Bruce Kirkland,False,3.5/5,fresh,Jam! Movies,"Even if this movie is short of perfection, it makes Star Wars complete.",POSITIVE,http://jam.canoe.ca/Movies/Reviews/S/Star_Wars_Episode3/2005/05/18/1044532.html
star_wars_episode_iii_revenge_of_the_sith,1393951,2005-05-18,Jack Garner,False,10/10,fresh,Rochester Democrat and Chronicle,"Ultimately, Revenge of the Sith resonates with surprising emotional power and an undeniable sense of finality.",POSITIVE,http://www.democratandchronicle.com/apps/pbcs.dll/article?AID=/20050518/LIVING0107/505180314/1052/ENT
star_wars_episode_iii_revenge_of_the_sith,1393950,2005-05-18,Duane Dudek,False,2.5/4,rotten,Milwaukee Journal Sentinel,The finale feels less the inevitable conclusion of some great saga than the predictable mooing of a reliable cash cow.,NEGATIVE,
star_wars_episode_iii_revenge_of_the_sith,1393949,2005-05-18,Rene Rodriguez,True,3/4,fresh,Miami Herald,Revenge of the Sith overcomes its dime-store dialogue and less than convincing performances through the sheer force of its director's vision.,POSITIVE,
