id,reviewId,creationDate,criticName,isTopCritic,originalScore,reviewState,publicatioName,reviewText,scoreSentiment,reviewUrl
ice_age_continental_drift,2092601,2012-06-26,Megan Lehmann,True,,fresh,Hollywood Reporter,"It's familiar, drawn-out shtick, and the humor lacks the subtlety of the first and best Ice Age, but there are some visually inventive high points.",POSITIVE,http://www.hollywoodreporter.com/review/ice-age-continental-drift-ray-romano-341355
ice_age_continental_drift,2092420,2012-06-25,Louise Keller,False,,fresh,Urban Cinefile,"Retains its central theme of the importance of family in a brand new colourful, happy adventure in 3D. Sid the goofy, buck-toothed Sloth (John Leguizamo) remains my favourite character",POSITIVE,http://www.urbancinefile.com.au/home/view.asp?a=18795&s=Reviews
ice_age_2,2723359,2020-09-11,Richard Propes,False,2.0/4.0,rotten,TheIndependentCritic.com,I never bought in to this film and found myself regularly distracted by animation that seemed bland and boring.,NEGATIVE,https://theindependentcritic.com/ice_age_2
ice_age_2,2723100,2020-09-11,Leigh Paatsch,False,2/5,rotten,Herald Sun (Australia),"Vaguely entertaining sequel to the big animated hit of 2002, but a bit flat...",NEGATIVE,https://www.heraldsun.com.au/entertainment/movies/leigh-paatsch/mega-weekend-freetoair-tv-movie-guide/news-story/1af29cb8e73582a470bee8880ee569b6
ice_age_2,1957174,2011-02-09,Heather Huntington,False,5/10,rotten,ReelzChannel.com,,NEGATIVE,http://www.reelzchannel.com/movie/156482/ice-age-the-meltdown/reviews/
ice_age_2,1830912,2009-07-06,Steve Biodrowski,False,,fresh,Cinefantastique,"Ice Age: The Meltdown is a considerable improvement over its predecessor...As before, Scrat (again voiced by Chris Wedge, who this time did not direct) steals the show.",POSITIVE,http://cinefantastiqueonline.com/2009/07/06/ice-age-2002-ice-age-the-meltdown-2006-retrospective-animated-film-reviews/
ice_age_2,1814104,2009-04-20,Cole Smithey,False,B-,fresh,ColeSmithey.com,"As with the first ""Ice Age"" movie it is Scrat the acorn-obsessed rodent who bookends the movie and steals the most laughs with his hilarious attempts at obtaining an ever-elusive acorn.",POSITIVE,http://www.colesmithey.com/capsules/2006/03/ice_age_the_mel.html
ice_age_2,1694672,2007-12-07,Amber Wilkinson,False,3/5,fresh,Eye for Film,I've seen cooked spaghetti with more tension.,POSITIVE,http://www.eyeforfilm.co.uk/reviews.php?id=4619
ice_age_2,1683858,2007-10-26,Rob Humanick,False,C-,rotten,Projection Booth,"For as endearing as Scrat's antics are, even they can't sustain the lackluster jokes that pass for humor for the bulk of the ninety-minute running time.",NEGATIVE,http://projectionbooth.blogspot.com/2007/01/ice-age-meltdown-2006-c.html
ice_age_2,1656828,2007-07-28,James Plath,False,3/4,fresh,Reel.com,"I'm not going to beat around the glacier. If you liked Ice Age, you're going to like this sequel.",POSITIVE,
ice_age_2,1577390,2007-02-06,Frank Lovece,False,,fresh,Film Journal International,"Abounds in well-paced gags, both visual and verbal.",POSITIVE,http://www.filmjournal.com/filmjournal/reviews/article_display.jsp?vnu_content_id=1002275521
ice_age_2,1562200,2006-12-13,Michael A. Smith,False,3.5/4,fresh,Nolan's Pop Culture Review,"The animation is beautiful, with the flowing water and icy cliffs perfectly rendered.",POSITIVE,http://www.crazedfanboy.com/npcr06/moviereviewpcr315.shtml
ice_age_2,1560770,2006-12-03,Jeffrey Chen,False,5/10,rotten,Window to the Movies,"If the animation studio Blue Sky has proven anything so far, it's that they're big league visual artists, but frankly pedestrian when it comes to stories.",NEGATIVE,http://www.windowtothemovies.com/af2006-2.html#iceage2
ice_age_2,1558259,2006-11-19,Betsy Bozdech,False,2.5/4,fresh,DVDJournal.com,"While not quite as fresh, charming, or focused as its predecessor, [this] is still a fine way to spend an hour and a half -- especially if you're a Scrat fan.",POSITIVE,http://www.dvdjournal.com/quickreviews/i/iceagemeltdown.q.shtml
ice_age_2,1545048,2006-10-03,Joseph Proimakis,False,2/5,rotten,Movies for the Masses,full review in Greek,NEGATIVE,http://mftm.blogspot.com/2006/04/ice-age-meltdown-2006.html
ice_age_2,1543153,2006-09-28,Peter T. Chattaway,False,2.5/4,rotten,Christianity Today,"Revels in clever, complex set-pieces and lowbrow, big-rear-end humor, but falls somewhat short when it comes to character development and interpersonal warmth.",NEGATIVE,http://www.christianitytoday.com/movies/reviews/2006/iceage2.html
ice_age_2,1533646,2006-08-23,Michael Szymanski,False,B-,fresh,Sci-Fi Weekly,"It's all about Scrat, that plain-looking Every-squirrel who never gives up, and it's only a matter of time before he gets his own feature.",POSITIVE,http://www.scifi.com/sfw/screen/sfw12451.html
ice_age_2,1517138,2006-06-24,Derek Adams,True,,rotten,Time Out,"The storyline wanes towards the end and, from the kids' point of view, the whole package lacks momentum.",NEGATIVE,http://www.timeout.com/film/83444.html
ice_age_2,1513249,2006-06-12,Todd Jorgenson,False,,rotten,Denton Record-Chronicle,"...missing the novelty of the first film, both in the imaginatively drawn prehistoric setting and the witty interaction between the characters.",NEGATIVE,
ice_age_2,1510455,2006-05-28,Kamal  'The Diva' Larsuel,False,1/5,rotten,3BlackChicks Review,meltdown - indeed.,NEGATIVE,http://3blackchicks.com/content/view/67/30/
ice_age_2,1506074,2006-05-12,Jim Lane,False,1/5,rotten,Sacramento News & Review,"If you thought the original was a lifeless, forgettable bore, you'll find the sequel outdoing it on both counts.",NEGATIVE,
ice_age_2,1503784,2006-05-06,Joe Utichi,False,3/5,fresh,FilmFocus,"Ice Age 2 works, if not as well as its predecessor, but it wants for that special something that makes Pixar's efforts such instant classics.",POSITIVE,
ice_age_2,1503790,2006-05-06,James Kendrick,False,2.5/5,rotten,Q Network Film Desk,,NEGATIVE,http://www.qnetwork.com/?page=review&id=1628
ice_age_2,1502013,2006-05-03,Rubin Safaya,False,,fresh,Cinemalogue,"...the film doesn't try to be too clever and hip for the kids, as have many animated movies of late in the endless attempt to sell attitude to credit-card wielding adults at the box office.",POSITIVE,http://www.cinemalogue.com/2006/03/31/ice-age-the-meltdown/
ice_age_2,1500441,2006-04-25,Karina Montgomery,False,2/5,rotten,Cinerina,Adult fans of animation: don't bother. Parents taking their kids: Spare them. Use the money to beef up your home DVD collection of Pixar titles or even expand into the old Warner Brothers cartoons.,NEGATIVE,http://ensim.streamstudiohost.net/~cinerina.com/reviews/archives/000796.html
ice_age_2,1500326,2006-04-24,Nicolas Lacroix,False,2.5/5,rotten,EnPrimeur.ca,"L'Ère de glace : La Fonte ne vaut pas vraiment le déplacement, ni celui de la calotte polaire ni le vôtre.",NEGATIVE,http://www.enprimeur.ca/index.asp?pageID=9&reviews_id=164
ice_age_2,1499449,2006-04-17,Larry Ratliff,False,2.5/4,rotten,San Antonio Express-News,"Unfortunately, the Ice Age sequel doesn't take a major step forward like Toy Story 2 in 1999.",NEGATIVE,
ice_age_2,1499016,2006-04-14,Kevin A. Ranson,False,2.5/4.0,rotten,MovieCrypt.com,"... a whole new adventure. Well, an outing. Okay, a long walk...",NEGATIVE,http://moviecrypt.com/?p=1087
ice_age_2,1498762,2006-04-13,Jessica Letkemann,False,2.5/4,fresh,Premiere Magazine,"The sequel is satisfying for the same reason as the first movie. The sweet animals are witty, and while the physical comedy is simple, the main characters ultimately aren't.",POSITIVE,http://www.premiere.com/moviereviews/2702/ice-age-the-meltdown.html
ice_age_2,1498463,2006-04-11,Mark Sells,False,2/5,rotten,Oregon Herald,"Finds itself on thin ice, unable to support a 10-ton mammoth, let alone a 9-ton possum.",NEGATIVE,http://www.thereeldeal.co/reviews/iceage2.html
ice_age_2,1498442,2006-04-11,Neil Smith,True,4/5,fresh,BBC.com,"Carlos Saldanha's mix of race-against-time action and eco-friendly propaganda is actually an improvement on the original, not least for giving its funniest character -- acorn-hunting rodent Scrat -- a lot more to do.",POSITIVE,http://www.bbc.co.uk/films/2006/04/05/ice_age_the_meltdown_2006_review.shtml
ice_age_2,1498385,2006-04-10,Forrest Hartman,False,3/4,fresh,Reno Gazette-Journal,"Although hardly a departure from the original, it is well-animated, well-voiced, and decently plotted.",POSITIVE,http://news.rgj.com/apps/pbcs.dll/article?AID=/20060331/ENT01/603310347/1056/ENT
ice_age_2,1498232,2006-04-08,Pablo Villaça,False,3/5,rotten,Cinema em Cena,"Assim como o original, tem seus melhores momentos quando o esquilo Scrat surge em cena. Pena que isso aconteça tão pouco.",NEGATIVE,
ice_age_2,1498173,2006-04-08,Enrique Buchichio,False,3/5,fresh,Uruguay Total,"A pesar de la poca innovación, esta segunda parte es casi tan divertida como la primera, sobre todo gracias a un estupendo personaje llamado Scrat.",POSITIVE,http://www.cartelera.com.uy/pelicula.php?id=1215
ice_age_2,1497935,2006-04-08,Philip French,True,,fresh,Guardian,"In its untouched-by-human-hand way, it's not bad and, as in the first film, the funniest moments involve the half-rat, half-squirrel Scrat.",POSITIVE,"http://film.guardian.co.uk/News_Story/Critic_Review/Observer_review/0,,1749975,00.html"
ice_age_2,1497924,2006-04-08,David Nusair,False,2/4,rotten,Reel Film Reviews,...viewers who enjoyed the bland original may also dig this one.,NEGATIVE,http://www.reelfilm.com/mini55.htm#ice
ice_age_2,1497932,2006-04-08,Kimberley Jones,True,2/5,rotten,Austin Chronicle,A watered-down likeness that curiously turns disaster flick in its too-scary third act.,NEGATIVE,http://www.austinchronicle.com/gyrobase/Calendar/Film?Film=oid%3a350473
ice_age_2,1497925,2006-04-08,Julian Roman,False,4/5,fresh,MovieWeb,Ice Age 2 surpasses the original in every way. Fox Animation has a film to be extremely proud of.,POSITIVE,http://www.movieweb.com/movie/ice-age-the-meltdown/REDSrDIJ4lRwHI
ice_age_2,1497920,2006-04-08,Wade Major,False,2.5/5,rotten,Boxoffice Magazine,A fast-melting and mostly watered-down scoop of an all-too-familiar flavor.,NEGATIVE,http://boxoffice.com/reviews/2008/08/ice-age-the-meltdown.php
ice_age_2,1497270,2006-04-06,Tyler Hanley,False,3/4,fresh,Palo Alto Weekly,Fans fired up by the first Ice Age won't be cooled down with this fun-loving follow-up.,POSITIVE,
ice_age_2,1497196,2006-04-06,Thomas Delapa,False,2/4,rotten,Boulder Weekly,It's hard to warm up to Ice Age 2 when most of it feels like a furry retread.,NEGATIVE,http://www.boulderweekly.com/screen.html
ice_age_2,1497150,2006-04-06,Eric Lurio,False,3.5/5,fresh,Greenwich Village Gazette,"The animation is excellent, and all the jokes, both visual and verbal work. It's worth taking the kids, even if you have to rent some.",POSITIVE,
ice_age_2,1497086,2006-04-06,Lori Hoffman,False,2.5/4,fresh,Atlantic City Weekly,The physical comedy is still first rate and should entertain most kids.,POSITIVE,
ice_age_2,1497044,2006-04-06,Jackie K. Cooper,False,8/10,fresh,jackiekcooper.com,A mammoth hit,POSITIVE,
ice_age_2,1497022,2006-04-06,Matthew Turner,False,3/5,fresh,ViewLondon,"Impressively animated, family-friendly comedy with likeable characters and some terrific comic set-pieces.",POSITIVE,http://www.viewlondon.co.uk/films/ice-age-2-the-meltdown-film-review-15148.html
ice_age_2,1496564,2006-04-04,Jonathan R. Perry,False,2/4,rotten,Tyler Morning Telegraph (Texas),The periodic fits of inspiration -- most of them courtesy of Scrat -- are just welcome breaks from an onslaught of witless pratfalling and white noise.,NEGATIVE,http://www.tylerpaper.com/apps/pbcs.dll/article?AID=/20060401/ARC/604010359&SearchID=73279727347397
ice_age_2,1496539,2006-04-04,Jim Ridley,True,,fresh,Village Voice,"Watching this zoo of long-vanished quadrupeds, you're left with an eerie message for our own warming times: They fought the thaw, and the thaw won.",POSITIVE,
ice_age_2,1496446,2006-04-03,Luis Martinez,False,2.5/5,rotten,Cinenganos,"Fría, muy fría... y no precisamente por el hielo",NEGATIVE,http://cinenganos.com/pelicula/IceAge2/
ice_age_2,1496411,2006-04-03,David Cornelius,False,2/5,rotten,eFilmCritic.com,It feels like a cheap direct-to-video rush job.,NEGATIVE,http://efilmcritic.com/review.php?movie=14284&reviewer=392
ice_age_2,1496397,2006-04-03,Sara Michelle Fetters,True,2/4,rotten,MovieFreak.com,"It isn't always out of whack, and I liked the way the writers tried to make Diego's fear of water into a universal metaphor relating to life in general, but the picture overall just doesn't work.",NEGATIVE,http://www.moviefreak.com/artman/publish/movies_iceage2.shtml
ice_age_2,1496387,2006-04-03,Richard Roeper,True,,rotten,Ebert & Roeper,"[The film] has lots of energy, some decent animation and good voice-over work -- but no real story and few chuckles.",NEGATIVE,
ice_age_2,1496377,2006-04-03,Linda Cook,False,3/4,fresh,"Quad City Times (Davenport, IA)","Maybe it's not quite as deep as its predecessor, but still you're bound to warm up to ""Ice Age: The Meltdown,"" because of the universal emotions shared by its characters.",POSITIVE,
ice_age_2,1496374,2006-04-03,Audrey Rock-Richardson,False,C+,rotten,Tooele Transcript-Bulletin (Utah),Scrat is still the highlight of an average children's movie.,NEGATIVE,
ice_age_2,1496368,2006-04-03,Kit Bowen,False,2.5/4,fresh,Hollywood.com,"How nice it is to see the whole Ice Age gang back, but unfortunately, this sequel falls under the ""cute-but-not-quite-as-good-as-the-original"" category.",POSITIVE,http://www.hollywood.com/review/Ice_Age_The_Meltdown/3487901
ice_age_2,1496364,2006-04-03,John P. McCarthy,False,,fresh,ReelTalk Movie Reviews,"This movie feels right more often than the first 'Ice Age,' which means a third installment is inevitable and eagerly anticipated.",POSITIVE,http://www.reeltalkreviews.com/browse/viewitem.asp?type=review&id=1632
ice_age_2,1496327,2006-04-02,Dan Lybarger,False,3/5,rotten,eFilmCritic.com,"There are some charming moments, but you have to wait for them.",NEGATIVE,http://efilmcritic.com/review.php?movie=14284&reviewer=382
ice_age_2,1496261,2006-04-02,Scott Nash,False,3/4,fresh,Three Movie Buffs,An easy and enjoyable way of spending an hour and a half.,POSITIVE,http://www.threemoviebuffs.com/review/iceage2themeltdown
ice_age_2,1496258,2006-04-02,Cherryl Dawson and Leigh Ann Palone,False,3.5/5,fresh,TheMovieChicks.com,A lot of sequels are complete meltdowns but this one stands up to the elements.,POSITIVE,http://www.themoviechicks.com/early2006/mcriceage2.html
ice_age_2,1496242,2006-04-01,Robin Clifford,False,C,rotten,Reeling Reviews,If you're under the age of 10 you will likely enjoy Ice Age: The Meltdown.,NEGATIVE,http://www.reelingreviews.com/iceagethemeltdown.htm
ice_age_2,1496223,2006-04-01,Mike McGranaghan,False,3/4,fresh,Aisle Seat,"For whatever it lacks in the way of a compelling story, Ice Age: The Meltdown still manages to give family audiences what they want and expect: lovable characters, gorgeous computer-generated animation, and laughter.",POSITIVE,http://www.geocities.com/gamut_mag/iceage2.htm
ice_age_2,1495661,2006-04-01,Rich Cline,False,3/5,fresh,Shadows on the Wall,"This film looks terrific, and has some wonderfully eye-grabbing sequences.... So it's a pity the story's so bland.",POSITIVE,http://www.shadowsonthewall.co.uk/06/iceage.htm
ice_age_2,1495663,2006-04-01,Paul Greenwood,False,8/10,fresh,Future Movies UK,,POSITIVE,http://www.futuremovies.co.uk/review.asp?ID=501
ice_age_2,1495659,2006-04-01,Scott A. Mantz,False,3/5,fresh,Scott Mantz' Movie Reviews,,POSITIVE,http://www.mightytreehouse.com/moviemantz/2006/03/24/ice-age-the-meltdown/
ice_age_2,1495658,2006-04-01,Jean Lowerison,False,,fresh,San Diego Metropolitan,A delight for all ages.,POSITIVE,http://sandiegometro.archives.whsites.net/reel/index.php?reelID=914
ice_age_2,1495655,2006-04-01,Caroline Westbrook,True,3/5,fresh,Empire Magazine,"It's charming enough, though, and there's plenty of laughs.",POSITIVE,http://www.empireonline.co.uk/incinemas/ReviewComplete.asp?FID=133721
ice_age_2,1495242,2006-03-31,Louis B. Hobson,False,4/5,fresh,Jam! Movies,"Ice Age: The Meltdown is a joy from start to finish, as nutty and irreverent as its tiny hero Scrat.",POSITIVE,
ice_age_2,1495241,2006-03-31,Todd McCarthy,True,,fresh,Variety,"A tad crasser and pushier than its predecessor, Ice Age: The Meltdown is still an entirely serviceable follow-up to the 2002 hit that will thoroughly amuse kids and get a rise or two out of parents as well.",POSITIVE,
ice_age_2,1495239,2006-03-31,Maitland McDonagh,False,3/4,fresh,TV Guide,"Prehistory's first blended herd begins a new adventure some tens of thousands of years after joining forces in the face of a global deep freeze (no, the math doesn't work, so stop worrying about it).",POSITIVE,
ice_age_2,1495236,2006-03-31,Geoff Pevere,True,2/4,rotten,Toronto Star,The Meltdown is at least faithful to its predecessor in the sense of being equally as underwhelming.,NEGATIVE,http://WWW.TheStar.COM/NASApp/cs/ContentServer?pagename=thestar/Layout/Article_Type1&c=Article&cid=1143803327002&call_pageid=1022183557980&col=1022183560753
ice_age_2,1495235,2006-03-31,Moira MacDonald,True,3/4,fresh,Seattle Times,"The film feels visually richer than its predecessor, but has the same brand of uncomplicated all-ages charm.",POSITIVE,http://community.seattletimes.nwsource.com/archive/?slug=ice31&date=20060331
ice_age_2,1495233,2006-03-31,Peter Hartlaub,True,2/4,rotten,San Francisco Chronicle,"The Meltdown is less a story than a series of complicated slapstick bits -- the physical gags are often enjoyable, but there's not much else to the movie.",NEGATIVE,http://www.sfgate.com/cgi-bin/article.cgi?f=/c/a/2006/03/31/DDG6TI0A911.DTL&type=movies
ice_age_2,1495229,2006-03-31,David Elliott,False,3/4,fresh,San Diego Union-Tribune,"Fire and freeze, flames and ice, it's all primal. And fairly prime as getaway entertainment.",POSITIVE,
ice_age_2,1495227,2006-03-31,Carla Meyer,False,2.5/4,rotten,Sacramento Bee,"Ice Age: The Meltdown seems like one of those straight-to-DVD animation sequels the studios love to churn out, and not just because of the colon in its title.",NEGATIVE,http://www.sacticket.com/movies/reviews/story/14236900p-15057768c.html
ice_age_2,1495218,2006-03-31,Jack Garner,False,8/10,fresh,Rochester Democrat and Chronicle,"The amusing gang from Ice Age is back for an encore in Ice Age: The Meltdown, a funny sequel that's on a par with 2002's entertaining original.",POSITIVE,http://www.democratandchronicle.com/apps/pbcs.dll/article?AID=/20060331/LIVING0107/603310362/1065/ENT04
ice_age_2,1495215,2006-03-31,Pam Grady,False,2/4,rotten,Reel.com,A curiously dour sequel to 2002's popular Ice Age.,NEGATIVE,
ice_age_2,1495213,2006-03-31,Josh Larsen,False,2/4,rotten,"Sun Publications (Chicago, IL)","Its prehistoric characters might as well be stretching their paws and claws out for money, because the picture gives them little else of consequence to do.",NEGATIVE,http://suburbanchicagonews.com/entertainment/movies/oa31ice.htm
ice_age_2,1495212,2006-03-31,Carrie Rickey,True,3/4,fresh,Philadelphia Inquirer,"On the short list of sequels superior to the originals -- alphabetically between The Godfather, Part II and Toy Story 2 -- you may enter Ice Age: The Meltdown.",POSITIVE,
ice_age_2,1495210,2006-03-31,Gary Thompson,False,B-,fresh,Philadelphia Daily News,"The animated work is generally first-rate, which is good, because some of the one-liners date to the ice age and beyond.",POSITIVE,
ice_age_2,1495209,2006-03-31,Roger Moore,True,2/5,rotten,Orlando Sentinel,"You'll take your kids, yes. But don't be surprised if this one leaves them cold as you-know-what.",NEGATIVE,
ice_age_2,1495204,2006-03-31,Lou Lumenick,True,3/4,fresh,New York Post,"Ice Age: The Meltdown, a follow-up to the 2002 animated prehistoric hit, is the rare sequel that is better than the original.",POSITIVE,
ice_age_2,1495200,2006-03-31,Jami Bernard,True,3/4,fresh,New York Daily News,"A good-natured, gag-filled sequel to the hit animated movie about animals trying to evade extinction while trading one-liners.",POSITIVE,
ice_age_2,1495196,2006-03-31,Peter Debruge,True,2.5/4,fresh,Miami Herald,"There's not much to Ice Age: The Meltdown, but it's enjoyable all the same.",POSITIVE,http://ae.miami.com/entertainment/ui/miami/movie.html?id=564233&reviewId=20433
ice_age_2,1495185,2006-03-31,Glenn Whipp,False,2.5/4,fresh,Los Angeles Daily News,"For a sequel, it'll do.",POSITIVE,
ice_age_2,1495181,2006-03-31,David Frese,False,2/4,rotten,Kansas City Star,"Parents forced by unruly ankle-biters to spend an afternoon at the multiplex could do worse than Ice Age: The Meltdown (Valiant, anyone?). But if kids could be persuaded to wait a few months for the DVD, it wouldn't be the end of the world.",NEGATIVE,http://www.kansascity.com/mld/kansascity/entertainment/14224634.htm
ice_age_2,1495171,2006-03-31,Steve Tilley,False,4/5,fresh,Jam! Movies,"It might not be a classic for the eons, but Ice Age: The Meltdown is so delightfully fun, funny and action-packed that it's hard to find cracks in its slick surface.",POSITIVE,
ice_age_2,1495164,2006-03-31,Amy Biancolli,True,3/4,fresh,Houston Chronicle,"Ice Age: The Meltdown crosses familiar territory but does so with exceeding sweetness and no shortage of visual imagination, bolstering what is, in essence, a fairly simplistic road movie with an eco-conscious twist.",POSITIVE,http://www.chron.com/disp/story.mpl/ent/movies/reviews/3704347.html
ice_age_2,1495157,2006-03-31,Luke Sader,True,,fresh,Hollywood Reporter,"A raucously fun, fluid follow-up with an ecological message.",POSITIVE,
ice_age_2,1495148,2006-03-31,E! Staff,False,B-,fresh,E! Online,"While this film has neither the insight or intellect of better Pixar films, it does have enough funny gags to keep the kids entertained and their parents from being bored.",POSITIVE,"http://www.eonline.com/Reviews/Movies/Leaves/0,20,3431,00.html"
ice_age_2,1495145,2006-03-31,Tom Long,True,C+,rotten,Detroit News,"The sequel to Ice Age is very much like the original: witty and imaginative at times, dull and predictable at others.",NEGATIVE,http://www.detnews.com/apps/pbcs.dll/article?AID=/20060331/ENT02/603310393/1034
ice_age_2,1495136,2006-03-31,Terry Lawson,True,2/4,rotten,Detroit Free Press,"There's something disheartening about the way the writers and director have to give so much of the dialogue double meaning, all literal for the kiddies and full of double-entendres and pop culture references for the parents.",NEGATIVE,
ice_age_2,1495132,2006-03-31,Jeff Vice,False,2.5/4,rotten,Deseret News (Salt Lake City),"Where the first Ice Age was low-key, this one is more frantic. And this time around the material is cruder, more lowbrow than it needs to be.",NEGATIVE,http://www.deseretnews.com/article/700004151/Ice-Age-The-Meltdown.html
ice_age_2,1495128,2006-03-31,David Germain,True,B-,fresh,Associated Press,"The movie is right on par with the 2002 original: brisk, pleasant and loaded with slapstick that should keep young children giggling.",POSITIVE,
ice_age_2,1495125,2006-03-31,Michael Booth,True,3/4,fresh,Denver Post,"If the rest of Meltdown is a three-star movie, Scrat brings four stars every time. Perhaps by the next sequel, they'll dispense with the filler and give Scrat his own movie.",POSITIVE,http://www.denverpost.com/movies/ci_3652096
ice_age_2,1495120,2006-03-31,Chris Vognar,True,B,fresh,Dallas Morning News,"Even when Meltdown melts down, it's still fun to look at.",POSITIVE,
ice_age_2,1495116,2006-03-31,Randy Myers,False,C+,rotten,Contra Costa Times,"Even though the animation sparkles, the screenplay is dull and in desperate need of some punching up.",NEGATIVE,http://ae.contracostatimes.com/entertainment/ui/cctimes/movie.html?id=564233&reviewId=20454
ice_age_2,1495110,2006-03-31,Lawrence Toppman,False,3/4,fresh,Charlotte Observer,"A sequel with more humor, topicality, intelligence and appeal [than the original].",POSITIVE,
ice_age_2,1495105,2006-03-31,Ty Burr,True,2/4,rotten,Boston Globe,Ice Age: The Meltdown is pure sequel product that should make children and undemanding grown-ups happy even as it lacks anything resembling storytelling inspiration.,NEGATIVE,http://www.boston.com/ae/movies/articles/2006/03/31/ice_age_sequel_offers_familiar_fun
ice_age_2,1495090,2006-03-31,Sean P. Means,False,3/4,fresh,Salt Lake Tribune,Scrat's antics rank with Chuck Jones' old Road Runner vs. Coyote cartoons for pure laughs.,POSITIVE,
ice_age_2,1495068,2006-03-31,Andy Klein,False,,rotten,Los Angeles CityBeat,"As in the first Ice Age, the predictable main story and the not-funny-enough script is a waste of some well-executed performances.",NEGATIVE,
ice_age_2,1495012,2006-03-31,John Beifuss,False,2.5/4,rotten,"Commercial Appeal (Memphis, TN)","In evolution, some things worked, some didn't (hooves and horns, good; shovel-shaped jaws on elephants, bad). The humor in 'Meltdown' is similarly hit-and-miss.",NEGATIVE,
ice_age_2,1495007,2006-03-31,Cynthia Fuchs,False,,fresh,Common Sense Media,"Like the original film, ICE AGE: THE MELTDOWN features appealing characters in recognizable, particularly familial situations.",POSITIVE,http://www.commonsensemedia.org/reviews/review.php?id=5035&type=Film
ice_age_2,1494947,2006-03-31,Daniel M. Kimmel,False,2/4,rotten,Worcester Telegram & Gazette,[I]f your offspring complain about being bored... congratulate them on growing up and developing taste.,NEGATIVE,http://64.166.24.148/datebook/moviereviews.cfm?titleid=12887&date=03/31/06&start_time=NOTPASSED&end_time=NOTPASSED
ice_age_2,1494938,2006-03-31,Angela Baldassarre,False,,fresh,Sympatico.ca,"""Ice Age: The Meltdown"" is not just a good sequel; it's faster, funnier, and just plain better than the original.",POSITIVE,http://entertainment.sympatico.msn.ca/movies/articles/1368104.armx
